{
  "$id": "https://commandlayer.org/schemas/v1.1.0/commercial/checkout/checkout.receipt.schema.json",
  "$schema": "https://json-schema.org/draft/2020-12/schema",
  "title": "checkout.receipt",
  "description": "Canonical checkout settlement receipt.",
  "type": "object",
  "additionalProperties": false,
  "$defs": {
    "money": {
      "type": "object",
      "additionalProperties": false,
      "required": [
        "amount",
        "currency"
      ],
      "properties": {
        "amount": {
          "type": "string",
          "pattern": "^(0|[1-9][0-9]*)(\\.[0-9]{1,6})?$",
          "maxLength": 40
        },
        "currency": {
          "type": "string",
          "pattern": "^[A-Z0-9]{2,16}$"
        },
        "decimals": {
          "type": "integer",
          "minimum": 0,
          "maximum": 18
        },
        "includes": {
          "type": "string",
          "enum": [
            "subtotal",
            "tax",
            "shipping",
            "fees",
            "discount",
            "total"
          ]
        }
      }
    },
    "actor": {
      "type": "object",
      "additionalProperties": false,
      "required": [
        "role",
        "id"
      ],
      "properties": {
        "role": {
          "type": "string",
          "enum": [
            "payer",
            "payee",
            "merchant",
            "provider",
            "carrier",
            "verifier"
          ]
        },
        "id": {
          "type": "string",
          "minLength": 1,
          "maxLength": 128
        },
        "kind": {
          "type": "string",
          "enum": [
            "agent",
            "organization",
            "wallet",
            "account",
            "service",
            "human"
          ]
        },
        "display_name": {
          "type": "string",
          "maxLength": 128
        },
        "uri": {
          "type": "string",
          "format": "uri",
          "maxLength": 512
        }
      }
    },
    "reference": {
      "type": "object",
      "additionalProperties": false,
      "required": [
        "type",
        "id"
      ],
      "properties": {
        "type": {
          "type": "string",
          "enum": [
            "order",
            "invoice",
            "authorization",
            "checkout",
            "purchase",
            "shipment",
            "fulfillment",
            "payment",
            "settlement",
            "receipt",
            "payment_requirement",
            "payment_session",
            "proof",
            "agent_card"
          ]
        },
        "id": {
          "type": "string",
          "minLength": 1,
          "maxLength": 128
        },
        "uri": {
          "type": "string",
          "format": "uri",
          "maxLength": 512
        }
      }
    },
    "amount_breakdown": {
      "type": "object",
      "additionalProperties": false,
      "required": [
        "subtotal",
        "total"
      ],
      "properties": {
        "subtotal": {
          "$ref": "#/$defs/money"
        },
        "tax": {
          "$ref": "#/$defs/money"
        },
        "fees": {
          "$ref": "#/$defs/money"
        },
        "discount": {
          "$ref": "#/$defs/money"
        },
        "shipping": {
          "$ref": "#/$defs/money"
        },
        "total": {
          "$ref": "#/$defs/money"
        }
      }
    },
    "settlement": {
      "type": "object",
      "additionalProperties": false,
      "required": [
        "status",
        "method",
        "settlement_ref",
        "amount"
      ],
      "properties": {
        "status": {
          "type": "string",
          "enum": [
            "captured",
            "failed",
            "pending"
          ]
        },
        "method": {
          "type": "string",
          "enum": [
            "x402",
            "stablecoin",
            "card",
            "bank_transfer",
            "credit"
          ]
        },
        "settlement_ref": {
          "type": "string",
          "minLength": 1,
          "maxLength": 128
        },
        "network_ref": {
          "type": "string",
          "minLength": 1,
          "maxLength": 128
        },
        "amount": {
          "$ref": "#/$defs/money"
        }
      }
    },
    "x402_proof": {
      "type": "object",
      "additionalProperties": false,
      "required": [
        "scheme",
        "proof_type",
        "proof_ref"
      ],
      "properties": {
        "scheme": {
          "type": "string",
          "const": "x402"
        },
        "proof_type": {
          "type": "string",
          "enum": [
            "payment-session",
            "payment-proof"
          ]
        },
        "proof_ref": {
          "type": "string",
          "minLength": 1,
          "maxLength": 128
        },
        "uri": {
          "type": "string",
          "format": "uri",
          "maxLength": 512
        }
      }
    }
  },
  "properties": {
    "protocol": {
      "type": "string",
      "const": "commercial"
    },
    "version": {
      "type": "string",
      "const": "1.1.0"
    },
    "verb": {
      "type": "string",
      "const": "checkout"
    },
    "receipt_id": {
      "type": "string",
      "minLength": 1,
      "maxLength": 128
    },
    "issued_at": {
      "type": "string",
      "format": "date-time"
    },
    "request_id": {
      "type": "string",
      "minLength": 1,
      "maxLength": 128
    },
    "status": {
      "type": "string",
      "enum": [
        "captured",
        "failed",
        "pending"
      ]
    },
    "payer": {
      "allOf": [
        {
          "$ref": "#/$defs/actor"
        },
        {
          "type": "object",
          "properties": {
            "role": {
              "const": "payer"
            }
          },
          "required": [
            "role"
          ]
        }
      ]
    },
    "merchant": {
      "allOf": [
        {
          "$ref": "#/$defs/actor"
        },
        {
          "type": "object",
          "properties": {
            "role": {
              "const": "merchant"
            }
          },
          "required": [
            "role"
          ]
        }
      ]
    },
    "order_ref": {
      "$ref": "#/$defs/reference"
    },
    "invoice_ref": {
      "$ref": "#/$defs/reference"
    },
    "settlement": {
      "$ref": "#/$defs/settlement"
    },
    "amount_breakdown": {
      "$ref": "#/$defs/amount_breakdown"
    },
    "fulfillment_ref": {
      "$ref": "#/$defs/reference"
    },
    "payment_proof": {
      "$ref": "#/$defs/x402_proof"
    },
    "reason": {
      "type": "string",
      "maxLength": 512
    }
  },
  "required": [
    "protocol",
    "version",
    "verb",
    "receipt_id",
    "issued_at",
    "request_id",
    "status",
    "payer",
    "merchant",
    "order_ref",
    "settlement",
    "amount_breakdown"
  ],
  "allOf": [
    {
      "if": {
        "properties": {
          "status": {
            "const": "captured"
          }
        }
      },
      "then": {
        "properties": {
          "settlement": {
            "type": "object",
            "properties": {
              "status": {
                "const": "captured"
              }
            },
            "required": [
              "status"
            ]
          },
          "payment_proof": {
            "type": "object",
            "properties": {
              "proof_type": {
                "const": "payment-proof"
              }
            },
            "required": [
              "proof_type"
            ]
          }
        },
        "required": [
          "settlement",
          "payment_proof"
        ]
      }
    },
    {
      "if": {
        "properties": {
          "status": {
            "const": "failed"
          }
        }
      },
      "then": {
        "properties": {
          "settlement": {
            "type": "object",
            "properties": {
              "status": {
                "const": "failed"
              }
            },
            "required": [
              "status"
            ]
          },
          "reason": {
            "type": "string",
            "maxLength": 512
          }
        },
        "required": [
          "settlement",
          "reason"
        ]
      }
    },
    {
      "if": {
        "properties": {
          "status": {
            "const": "pending"
          }
        }
      },
      "then": {
        "properties": {
          "settlement": {
            "type": "object",
            "properties": {
              "status": {
                "const": "pending"
              }
            },
            "required": [
              "status"
            ]
          },
          "reason": {
            "type": "string",
            "maxLength": 512
          }
        },
        "required": [
          "settlement",
          "reason"
        ]
      }
    }
  ]
}
