{
  "protocol": "commercial",
  "version": "1.1.0",
  "verb": "checkout",
  "receipt_id": "checkoutrcpt-001",
  "issued_at": "2026-03-19T10:05:03Z",
  "request_id": "checkoutreq-001",
  "status": "captured",
  "payer": {
    "role": "payer",
    "id": "buyer-001",
    "kind": "account"
  },
  "merchant": {
    "role": "merchant",
    "id": "merchant.example",
    "kind": "organization"
  },
  "order_ref": {
    "type": "order",
    "id": "ord-1001"
  },
  "invoice_ref": {
    "type": "invoice",
    "id": "inv-1001"
  },
  "settlement": {
    "status": "captured",
    "method": "x402",
    "settlement_ref": "settle-001",
    "network_ref": "0xabc123",
    "amount": {
      "amount": "49.99",
      "currency": "USDC",
      "decimals": 2
    }
  },
  "amount_breakdown": {
    "subtotal": {
      "amount": "49.99",
      "currency": "USDC",
      "decimals": 2
    },
    "total": {
      "amount": "49.99",
      "currency": "USDC",
      "decimals": 2
    }
  },
  "fulfillment_ref": {
    "type": "receipt",
    "id": "fulfill-001",
    "uri": "https://merchant.example/fulfillment/fulfill-001"
  },
  "payment_proof": {
    "scheme": "x402",
    "proof_type": "payment-proof",
    "proof_ref": "proof-001",
    "uri": "https://merchant.example/x402/proofs/proof-001"
  }
}
